{
  "artifact_store_identity": {
    "artifact_count": 65,
    "blob_count": 280,
    "integrity_status": "healthy",
    "inventory_id": "sai_a0b9e6183a7bed95d9dbcce918a19c9e2f63a67ffbc7617a2091b7a37955d312",
    "missing_reachable_artifact_count": 0,
    "reachability_plan_id": "rap_f3aca751ad751c976888fd9b464f9f56dd4913339b226786c0c3a7ef65ccc247",
    "unreferenced_blob_count": 0
  },
  "business_changed_files": [
    "backend/services/engine/artifact_store/__init__.py",
    "backend/services/engine/artifact_store/blob_store.py",
    "backend/services/engine/artifact_store/canonical.py",
    "backend/services/engine/artifact_store/config.py",
    "backend/services/engine/artifact_store/current.py",
    "backend/services/engine/artifact_store/descriptor.py",
    "backend/services/engine/artifact_store/enums.py",
    "backend/services/engine/artifact_store/errors.py",
    "backend/services/engine/artifact_store/identity.py",
    "backend/services/engine/artifact_store/importer.py",
    "backend/services/engine/artifact_store/integrity.py",
    "backend/services/engine/artifact_store/inventory.py",
    "backend/services/engine/artifact_store/materializer.py",
    "backend/services/engine/artifact_store/models.py",
    "backend/services/engine/artifact_store/reachability.py",
    "backend/services/engine/artifact_store/security.py",
    "backend/services/engine/artifact_store/store.py",
    "backend/services/engine/artifact_store/validators.py",
    "backend/services/tests/test_artifact_store_blob.py",
    "backend/services/tests/test_artifact_store_import.py",
    "backend/services/tests/test_artifact_store_integrity.py",
    "backend/services/tests/test_artifact_store_real_research.py",
    "backend/services/tests/test_quantmind2_context_bootstrap.py",
    "docs/quantmind2/context/COMPONENT_CATALOG.md",
    "docs/quantmind2/context/CURRENT_STATE.md",
    "docs/quantmind2/context/HANDOFF.md",
    "docs/quantmind2/context/KNOWN_ISSUES.md",
    "docs/quantmind2/context/ROADMAP.md",
    "docs/quantmind2/context/component_catalog.json",
    "docs/quantmind2/context/current_state.json",
    "docs/quantmind2/context/handoff.json",
    "docs/quantmind2/context/known_issues.json",
    "docs/quantmind2/context/roadmap.json",
    "docs/quantmind2/implementation/RESEARCH_ARTIFACT_MIGRATION_V1.md",
    "docs/quantmind2/implementation/RESEARCH_ARTIFACT_RECOVERY_V1.md",
    "docs/quantmind2/implementation/RESEARCH_ARTIFACT_STORE_V1.md",
    "docs/quantmind2/implementation/runs/2026/2026-07/QM2-P0-010-20260717T154150Z-26cebb9/report.md",
    "docs/quantmind2/implementation/schemas/current_state_v1.schema.json",
    "docs/quantmind2/implementation/schemas/handoff_v1.schema.json",
    "tools/quantmind2/artifact_store.py",
    "tools/quantmind2/validate_context_bootstrap.py"
  ],
  "business_changed_files_manifest_exclusion_verified": true,
  "correction_id": "qm2-p0-010-git-inventory-correction-v1",
  "effect": "evidence_correction_only",
  "fields": {
    "integrity.git_added_paths": {
      "missing": [
        "docs/quantmind2/implementation/runs/2026/2026-07/QM2-P0-010-20260717T154150Z-26cebb9/manifest.json"
      ],
      "recorded": [
        "backend/services/engine/artifact_store/__init__.py",
        "backend/services/engine/artifact_store/blob_store.py",
        "backend/services/engine/artifact_store/canonical.py",
        "backend/services/engine/artifact_store/config.py",
        "backend/services/engine/artifact_store/current.py",
        "backend/services/engine/artifact_store/descriptor.py",
        "backend/services/engine/artifact_store/enums.py",
        "backend/services/engine/artifact_store/errors.py",
        "backend/services/engine/artifact_store/identity.py",
        "backend/services/engine/artifact_store/importer.py",
        "backend/services/engine/artifact_store/integrity.py",
        "backend/services/engine/artifact_store/inventory.py",
        "backend/services/engine/artifact_store/materializer.py",
        "backend/services/engine/artifact_store/models.py",
        "backend/services/engine/artifact_store/reachability.py",
        "backend/services/engine/artifact_store/security.py",
        "backend/services/engine/artifact_store/store.py",
        "backend/services/engine/artifact_store/validators.py",
        "backend/services/tests/test_artifact_store_blob.py",
        "backend/services/tests/test_artifact_store_import.py",
        "backend/services/tests/test_artifact_store_integrity.py",
        "backend/services/tests/test_artifact_store_real_research.py",
        "docs/quantmind2/implementation/RESEARCH_ARTIFACT_MIGRATION_V1.md",
        "docs/quantmind2/implementation/RESEARCH_ARTIFACT_RECOVERY_V1.md",
        "docs/quantmind2/implementation/RESEARCH_ARTIFACT_STORE_V1.md",
        "docs/quantmind2/implementation/runs/2026/2026-07/QM2-P0-010-20260717T154150Z-26cebb9/report.md",
        "tools/quantmind2/artifact_store.py"
      ],
      "unexpected": [],
      "verified": [
        "backend/services/engine/artifact_store/__init__.py",
        "backend/services/engine/artifact_store/blob_store.py",
        "backend/services/engine/artifact_store/canonical.py",
        "backend/services/engine/artifact_store/config.py",
        "backend/services/engine/artifact_store/current.py",
        "backend/services/engine/artifact_store/descriptor.py",
        "backend/services/engine/artifact_store/enums.py",
        "backend/services/engine/artifact_store/errors.py",
        "backend/services/engine/artifact_store/identity.py",
        "backend/services/engine/artifact_store/importer.py",
        "backend/services/engine/artifact_store/integrity.py",
        "backend/services/engine/artifact_store/inventory.py",
        "backend/services/engine/artifact_store/materializer.py",
        "backend/services/engine/artifact_store/models.py",
        "backend/services/engine/artifact_store/reachability.py",
        "backend/services/engine/artifact_store/security.py",
        "backend/services/engine/artifact_store/store.py",
        "backend/services/engine/artifact_store/validators.py",
        "backend/services/tests/test_artifact_store_blob.py",
        "backend/services/tests/test_artifact_store_import.py",
        "backend/services/tests/test_artifact_store_integrity.py",
        "backend/services/tests/test_artifact_store_real_research.py",
        "docs/quantmind2/implementation/RESEARCH_ARTIFACT_MIGRATION_V1.md",
        "docs/quantmind2/implementation/RESEARCH_ARTIFACT_RECOVERY_V1.md",
        "docs/quantmind2/implementation/RESEARCH_ARTIFACT_STORE_V1.md",
        "docs/quantmind2/implementation/runs/2026/2026-07/QM2-P0-010-20260717T154150Z-26cebb9/manifest.json",
        "docs/quantmind2/implementation/runs/2026/2026-07/QM2-P0-010-20260717T154150Z-26cebb9/report.md",
        "tools/quantmind2/artifact_store.py"
      ]
    },
    "integrity.git_changed_paths": {
      "missing": [
        "docs/quantmind2/implementation/runs/2026/2026-07/QM2-P0-010-20260717T154150Z-26cebb9/manifest.json"
      ],
      "recorded": [
        "backend/services/engine/artifact_store/__init__.py",
        "backend/services/engine/artifact_store/blob_store.py",
        "backend/services/engine/artifact_store/canonical.py",
        "backend/services/engine/artifact_store/config.py",
        "backend/services/engine/artifact_store/current.py",
        "backend/services/engine/artifact_store/descriptor.py",
        "backend/services/engine/artifact_store/enums.py",
        "backend/services/engine/artifact_store/errors.py",
        "backend/services/engine/artifact_store/identity.py",
        "backend/services/engine/artifact_store/importer.py",
        "backend/services/engine/artifact_store/integrity.py",
        "backend/services/engine/artifact_store/inventory.py",
        "backend/services/engine/artifact_store/materializer.py",
        "backend/services/engine/artifact_store/models.py",
        "backend/services/engine/artifact_store/reachability.py",
        "backend/services/engine/artifact_store/security.py",
        "backend/services/engine/artifact_store/store.py",
        "backend/services/engine/artifact_store/validators.py",
        "backend/services/tests/test_artifact_store_blob.py",
        "backend/services/tests/test_artifact_store_import.py",
        "backend/services/tests/test_artifact_store_integrity.py",
        "backend/services/tests/test_artifact_store_real_research.py",
        "backend/services/tests/test_quantmind2_context_bootstrap.py",
        "docs/quantmind2/context/COMPONENT_CATALOG.md",
        "docs/quantmind2/context/CURRENT_STATE.md",
        "docs/quantmind2/context/HANDOFF.md",
        "docs/quantmind2/context/KNOWN_ISSUES.md",
        "docs/quantmind2/context/ROADMAP.md",
        "docs/quantmind2/context/component_catalog.json",
        "docs/quantmind2/context/current_state.json",
        "docs/quantmind2/context/handoff.json",
        "docs/quantmind2/context/known_issues.json",
        "docs/quantmind2/context/roadmap.json",
        "docs/quantmind2/implementation/RESEARCH_ARTIFACT_MIGRATION_V1.md",
        "docs/quantmind2/implementation/RESEARCH_ARTIFACT_RECOVERY_V1.md",
        "docs/quantmind2/implementation/RESEARCH_ARTIFACT_STORE_V1.md",
        "docs/quantmind2/implementation/runs/2026/2026-07/QM2-P0-010-20260717T154150Z-26cebb9/report.md",
        "docs/quantmind2/implementation/schemas/current_state_v1.schema.json",
        "docs/quantmind2/implementation/schemas/handoff_v1.schema.json",
        "tools/quantmind2/artifact_store.py",
        "tools/quantmind2/validate_context_bootstrap.py"
      ],
      "unexpected": [],
      "verified": [
        "backend/services/engine/artifact_store/__init__.py",
        "backend/services/engine/artifact_store/blob_store.py",
        "backend/services/engine/artifact_store/canonical.py",
        "backend/services/engine/artifact_store/config.py",
        "backend/services/engine/artifact_store/current.py",